{
  "schemaVersion": 1,
  "provisional": false,
  "calibration": {
    "status": "pinned-A-G-Settings-34286120355-Graph-timing-34288560611-Settings-JS-34739467180",
    "runtimeFormula": "ceil(measured p95 * 1.15)",
    "assetFormula": "ceil(built bytes * 1.05)"
  },
  "environment": {
    "os": "ubuntu-24.04",
    "platform": "linux",
    "architecture": "x64",
    "node": "v22.22.0"
  },
  "samples": {
    "timing": 10,
    "idleMemory": 5
  },
  "assets": {
    "maxJsChunkBytes": 484475,
    "initial": {
      "jsBytes": 484475,
      "cssBytes": 70902,
      "fontBytes": 88961
    },
    "routes": {
      "home": { "jsBytes": 132302, "cssBytes": 17820, "fontBytes": 0 },
      "search": { "jsBytes": 31589, "cssBytes": 6875, "fontBytes": 0 },
      "knowledge": { "jsBytes": 73579, "cssBytes": 11097, "fontBytes": 0 },
      "knowledgeDetail": { "jsBytes": 73579, "cssBytes": 11097, "fontBytes": 0 },
      "code": { "jsBytes": 31589, "cssBytes": 6875, "fontBytes": 0 },
      "codeSymbol": { "jsBytes": 58539, "cssBytes": 21217, "fontBytes": 0 },
      "workstreams": { "jsBytes": 94685, "cssBytes": 12290, "fontBytes": 0 },
      "diagrams": {"jsBytes":81789,"cssBytes":4199,"fontBytes":0},
      "diagramDetail": {"jsBytes":649168,"cssBytes":4199,"fontBytes":0},
      "specs": { "jsBytes": 23795, "cssBytes": 9571, "fontBytes": 0 },
      "specsDetail": { "jsBytes": 23795, "cssBytes": 9571, "fontBytes": 0 },
      "playbooks": { "jsBytes": 7095, "cssBytes": 3510, "fontBytes": 0 },
      "catchUp": { "jsBytes": 7095, "cssBytes": 3510, "fontBytes": 0 },
      "inbox": { "jsBytes": 120514, "cssBytes": 15589, "fontBytes": 0 },
      "relays": { "jsBytes": 200128, "cssBytes": 12285, "fontBytes": 0 },
      "members": { "jsBytes": 93022, "cssBytes": 12640, "fontBytes": 0 },
      "activity": { "jsBytes": 66663, "cssBytes": 19437, "fontBytes": 0 },
      "jobs": { "jsBytes": 29416, "cssBytes": 14641, "fontBytes": 0 },
      "health": { "jsBytes": 30410, "cssBytes": 16736, "fontBytes": 0 },
      "settings": { "jsBytes": 8978, "cssBytes": 2910, "fontBytes": 0 },
      "notFound": { "jsBytes": 7095, "cssBytes": 3510, "fontBytes": 0 }
    }
  },
  "runtime": {
    "coldHubReadyMs": { "small": 941, "medium": 937, "large": 940 },
    "idleRssBytes": { "small": 205750272, "medium": 205345178, "large": 210295808 },
    "idleCpuMs": { "small": 0, "medium": 0, "large": 12 },
    "apiLatencyMs": {
      "small": { "search": 110, "code": 51, "knowledge": 68, "activity": 9, "inboxDrafts": 7, "inboxProposals": 6, "relayDrafts": 5, "relays": 15 },
      "medium": { "search": 176, "code": 79, "knowledge": 105, "activity": 28, "inboxDrafts": 7, "inboxProposals": 6, "relayDrafts": 3, "relays": 12 },
      "large": { "search": 342, "code": 142, "knowledge": 215, "activity": 58, "inboxDrafts": 7, "inboxProposals": 6, "relayDrafts": 4, "relays": 13 }
    },
    "maintenanceMs": {
      "small": { "graph_refresh": 1634, "graph_rebuild": 1689, "wiki_refresh": 186, "wiki_rebuild": 181 },
      "medium": { "graph_refresh": 1842, "graph_rebuild": 1820, "wiki_refresh": 262, "wiki_rebuild": 301 },
      "large": { "graph_refresh": 1812, "graph_rebuild": 2278, "wiki_refresh": 418, "wiki_rebuild": 617 }
    },
    "maintenancePeakRssBytes": {
      "small": { "graph_refresh": 470639616, "graph_rebuild": 518977741, "wiki_refresh": 512307815, "wiki_rebuild": 512604570 },
      "medium": { "graph_refresh": 546006016, "graph_rebuild": 645174068, "wiki_refresh": 630675456, "wiki_rebuild": 630986343 },
      "large": { "graph_refresh": 604061696, "graph_rebuild": 767922381, "wiki_refresh": 758793626, "wiki_rebuild": 759226983 }
    },
    "browserHeapBytes": {
      "small": {
        "home": 4932332, "search": 5426602, "knowledge": 4769934, "knowledgeDetail": 4855696,
        "code": 5388496, "codeSymbol": 4845185, "workstreams": 6091035, "diagrams": null, "diagramDetail": null, "specs": 6180560, "specsDetail": 6166273,
        "playbooks": 4203807, "catchUp": 4203807, "inbox": 6492790, "relays": 7753875, "members": 4902625, "activity": 4874206,
        "jobs": 4567014, "health": 4510981, "settings": 6302493, "notFound": 4185582
      },
      "medium": {
        "home": 4931467, "search": 5762301, "knowledge": 5013554, "knowledgeDetail": 4856552,
        "code": 5720349, "codeSymbol": 4849523, "workstreams": 6070059, "diagrams": null, "diagramDetail": null, "specs": 6182460, "specsDetail": 6166337,
        "playbooks": 4199281, "catchUp": 4199281, "inbox": 6497358, "relays": 7754561, "members": 4886295, "activity": 5130992,
        "jobs": 4564691, "health": 4511036, "settings": 6304420, "notFound": 4185554
      },
      "large": {
        "home": 4933528, "search": 6027330, "knowledge": 5135808, "knowledgeDetail": 4858258,
        "code": 5989987, "codeSymbol": 4847729, "workstreams": 6091086, "diagrams": null, "diagramDetail": null, "specs": 6175215, "specsDetail": 6170891,
        "playbooks": 4203858, "catchUp": 4203858, "inbox": 6504906, "relays": 7748627, "members": 4895624, "activity": 5275901,
        "jobs": 4563113, "health": 4509017, "settings": 6308933, "notFound": 4181773
      }
    },
    "databaseToInputRatio": {
      "small": { "graph": 188, "wiki": 82 },
      "medium": { "graph": 126, "wiki": 23 },
      "large": { "graph": 109, "wiki": 12 }
    }
  }
}
